{
  "schema_version": "v0",
  "release_candidate_digest": "6035e93417ab81dc81b8496360f45b140416f1398a2aaec64fe3aeaccb4d27dd",
  "task_set_digest": "30591f062179be28924d20945d1457e68bddde98bd8bc93913e45cf4d5c20e6f",
  "results": [
    {
      "path": "results/6035e93417ab81dc81b8496360f45b140416f1398a2aaec64fe3aeaccb4d27dd/apex-forge-v1--simple--v1-skill.json",
      "sha256": "23cdfceb4a204e3652ed0aff904f528963de7d1197d3f77814496f2fdaa000c2"
    },
    {
      "path": "results/6035e93417ab81dc81b8496360f45b140416f1398a2aaec64fe3aeaccb4d27dd/apex-forge-v1--simple--cli-kernel.json",
      "sha256": "dd80d0dd481b9db75388bb53675c44df1bb72678fefc254841528e4f2f7c2479"
    },
    {
      "path": "results/6035e93417ab81dc81b8496360f45b140416f1398a2aaec64fe3aeaccb4d27dd/apex-forge-v1--simple--plugin-kernel.json",
      "sha256": "9bac935f09475f0dfae259dfb34c56cf2fbab29ed0c863c3f687cf97ba657794"
    },
    {
      "path": "results/6035e93417ab81dc81b8496360f45b140416f1398a2aaec64fe3aeaccb4d27dd/apex-forge-v1--multi-step--v1-skill.json",
      "sha256": "82f28554530c461834042bc8b030f62202e3ca5b6d2d0632a477e1cceb7e9204"
    },
    {
      "path": "results/6035e93417ab81dc81b8496360f45b140416f1398a2aaec64fe3aeaccb4d27dd/apex-forge-v1--multi-step--cli-kernel.json",
      "sha256": "63d5d95fbd17cfcc74b3adccf19920d2eda5643540540d8100856b293734d51a"
    },
    {
      "path": "results/6035e93417ab81dc81b8496360f45b140416f1398a2aaec64fe3aeaccb4d27dd/apex-forge-v1--multi-step--plugin-kernel.json",
      "sha256": "579bef66ebd6740037fc3ca803268509b7017e4f2829f4aae66280cbde7175b5"
    },
    {
      "path": "results/6035e93417ab81dc81b8496360f45b140416f1398a2aaec64fe3aeaccb4d27dd/apex-forge-v1--bug-fix--v1-skill.json",
      "sha256": "c4357c906e9d9275bd5fee410a862dbb2d6afbbbc09d2ff2d53580211f49271f"
    },
    {
      "path": "results/6035e93417ab81dc81b8496360f45b140416f1398a2aaec64fe3aeaccb4d27dd/apex-forge-v1--bug-fix--cli-kernel.json",
      "sha256": "e41e7d78b2638912ab9404e714af87abd570cb3b6cf17c2324ba48c48ea91351"
    },
    {
      "path": "results/6035e93417ab81dc81b8496360f45b140416f1398a2aaec64fe3aeaccb4d27dd/apex-forge-v1--bug-fix--plugin-kernel.json",
      "sha256": "19c5a7504a5de112d861a1092fc2578b96bcfe135f01b050501db37dd2254d07"
    },
    {
      "path": "results/6035e93417ab81dc81b8496360f45b140416f1398a2aaec64fe3aeaccb4d27dd/apex-forge-v1--interrupted--v1-skill.json",
      "sha256": "7eb09b8faa6cc181dfb9096fc2e2a95cfb5fbd6331de9b0eb55a76d814b7e60b"
    },
    {
      "path": "results/6035e93417ab81dc81b8496360f45b140416f1398a2aaec64fe3aeaccb4d27dd/apex-forge-v1--interrupted--cli-kernel.json",
      "sha256": "c68dd0c415039a5b19ebfd3296bf198e8f1d6f40fb807e5a6ac8db50d6756f34"
    },
    {
      "path": "results/6035e93417ab81dc81b8496360f45b140416f1398a2aaec64fe3aeaccb4d27dd/apex-forge-v1--interrupted--plugin-kernel.json",
      "sha256": "ef176d4a6d6ff989535087ec5c5f646bccb44439985de9bc3ddcbf819c961d16"
    },
    {
      "path": "results/6035e93417ab81dc81b8496360f45b140416f1398a2aaec64fe3aeaccb4d27dd/apex-forge-v1--review-defect--v1-skill.json",
      "sha256": "1f820321881ac975a1d110b0591a0e1137fe0841ea8caef92262591efca095d1"
    },
    {
      "path": "results/6035e93417ab81dc81b8496360f45b140416f1398a2aaec64fe3aeaccb4d27dd/apex-forge-v1--review-defect--cli-kernel.json",
      "sha256": "a34636065c1d9fc9168408b5787bd70179fb207d83e5e36691f29421d67812f9"
    },
    {
      "path": "results/6035e93417ab81dc81b8496360f45b140416f1398a2aaec64fe3aeaccb4d27dd/apex-forge-v1--review-defect--plugin-kernel.json",
      "sha256": "0b423007be2c47ecff32bd738e8fe7105abd5eb332318cd5e4f3150cf0f46b02"
    },
    {
      "path": "results/6035e93417ab81dc81b8496360f45b140416f1398a2aaec64fe3aeaccb4d27dd/apex-forge-v1--parallel--v1-skill.json",
      "sha256": "db203a1e144bd57bb6361a9d6cd7d78ec9f99febdcc47fd5082e9c2cb82d16c0"
    },
    {
      "path": "results/6035e93417ab81dc81b8496360f45b140416f1398a2aaec64fe3aeaccb4d27dd/apex-forge-v1--parallel--cli-kernel.json",
      "sha256": "7a43746b57ae67f50bc63d74964304916a8e7fd9efc30de384826c18cf5980dd"
    },
    {
      "path": "results/6035e93417ab81dc81b8496360f45b140416f1398a2aaec64fe3aeaccb4d27dd/apex-forge-v1--parallel--plugin-kernel.json",
      "sha256": "92c0cd25d963b51aa84c8ed8f8335651b984e8080416122ebb7fbf2094e980af"
    },
    {
      "path": "results/6035e93417ab81dc81b8496360f45b140416f1398a2aaec64fe3aeaccb4d27dd/apex-manager--simple--v1-skill.json",
      "sha256": "595c7624c8161d48c1cfff6bd996992d7f755e91601fd72bd88b2328db6ba668"
    },
    {
      "path": "results/6035e93417ab81dc81b8496360f45b140416f1398a2aaec64fe3aeaccb4d27dd/apex-manager--simple--cli-kernel.json",
      "sha256": "0499585fd762eb71d397297fbb675e343eeef858e6f360f9ff6769c9e404c950"
    },
    {
      "path": "results/6035e93417ab81dc81b8496360f45b140416f1398a2aaec64fe3aeaccb4d27dd/apex-manager--simple--plugin-kernel.json",
      "sha256": "aac213600b91b805139fce3857f527de698e9e991e69be578383722467973eb8"
    },
    {
      "path": "results/6035e93417ab81dc81b8496360f45b140416f1398a2aaec64fe3aeaccb4d27dd/apex-manager--multi-step--v1-skill.json",
      "sha256": "c9315175c420c1eabea17bf054677c6d2dc56eb86ebc8709bb0e66dba51ebab1"
    },
    {
      "path": "results/6035e93417ab81dc81b8496360f45b140416f1398a2aaec64fe3aeaccb4d27dd/apex-manager--multi-step--cli-kernel.json",
      "sha256": "befacb5ec72de935ea28f808ce6c78b6394a1f79a848a2f81708c3a87209c529"
    },
    {
      "path": "results/6035e93417ab81dc81b8496360f45b140416f1398a2aaec64fe3aeaccb4d27dd/apex-manager--multi-step--plugin-kernel.json",
      "sha256": "ecf08d39dd01ce7aad93b39741df3be91645efafca812a19c138760e541bc1ce"
    },
    {
      "path": "results/6035e93417ab81dc81b8496360f45b140416f1398a2aaec64fe3aeaccb4d27dd/apex-manager--bug-fix--v1-skill.json",
      "sha256": "664a6b2a45eb0f3e4fb0020d50af3664829affb4d5334fa1567a4cc4a73f41c0"
    },
    {
      "path": "results/6035e93417ab81dc81b8496360f45b140416f1398a2aaec64fe3aeaccb4d27dd/apex-manager--bug-fix--cli-kernel.json",
      "sha256": "d5d2c34929f6e95166131391a11ee01ffdb63ef30677e100df30d8ef2e4b4c79"
    },
    {
      "path": "results/6035e93417ab81dc81b8496360f45b140416f1398a2aaec64fe3aeaccb4d27dd/apex-manager--bug-fix--plugin-kernel.json",
      "sha256": "e3b98a96edb560760533431669c105821bf421f42913355cc34f799949f54009"
    },
    {
      "path": "results/6035e93417ab81dc81b8496360f45b140416f1398a2aaec64fe3aeaccb4d27dd/apex-manager--interrupted--v1-skill.json",
      "sha256": "ffae79fbdbcfa2d99bad547f0ffc7bae20edd79c0cbf858d35b7e8b279b182ae"
    },
    {
      "path": "results/6035e93417ab81dc81b8496360f45b140416f1398a2aaec64fe3aeaccb4d27dd/apex-manager--interrupted--cli-kernel.json",
      "sha256": "4863acfd3709ae66ee7ba903ca7f373077e5eb105ada87ca1f0ec23f445802f1"
    },
    {
      "path": "results/6035e93417ab81dc81b8496360f45b140416f1398a2aaec64fe3aeaccb4d27dd/apex-manager--interrupted--plugin-kernel.json",
      "sha256": "d43a6b479f2eb8beec1a74b31d591e306f3d205753c7f7f236d19721807cd069"
    },
    {
      "path": "results/6035e93417ab81dc81b8496360f45b140416f1398a2aaec64fe3aeaccb4d27dd/apex-manager--review-defect--v1-skill.json",
      "sha256": "66539e59745b2cfa22d66768ed79e6f918aed02161195999e261afcee49d52fd"
    },
    {
      "path": "results/6035e93417ab81dc81b8496360f45b140416f1398a2aaec64fe3aeaccb4d27dd/apex-manager--review-defect--cli-kernel.json",
      "sha256": "10b3efaaf104f42df8c7fb3cb26e5deb8fc01131f24dacb2e521a9b9dacd004d"
    },
    {
      "path": "results/6035e93417ab81dc81b8496360f45b140416f1398a2aaec64fe3aeaccb4d27dd/apex-manager--review-defect--plugin-kernel.json",
      "sha256": "3894818c85c9ab7ab8a95dc1aedde116f30249aa5b8674888837146ffc93ec5e"
    },
    {
      "path": "results/6035e93417ab81dc81b8496360f45b140416f1398a2aaec64fe3aeaccb4d27dd/apex-manager--parallel--v1-skill.json",
      "sha256": "1758ea5050a426109588a1569badf30f7ae4c32d03c329d7034ace07b998d6e0"
    },
    {
      "path": "results/6035e93417ab81dc81b8496360f45b140416f1398a2aaec64fe3aeaccb4d27dd/apex-manager--parallel--cli-kernel.json",
      "sha256": "598b665bdf1161c0bb438945567bda86489f98862d137a5f79f9acd4bd13a045"
    },
    {
      "path": "results/6035e93417ab81dc81b8496360f45b140416f1398a2aaec64fe3aeaccb4d27dd/apex-manager--parallel--plugin-kernel.json",
      "sha256": "4252ced8925b345c95d0d2a239c6d4258da958fdc4ff26dac2d2ab04183a9b7d"
    },
    {
      "path": "results/6035e93417ab81dc81b8496360f45b140416f1398a2aaec64fe3aeaccb4d27dd/agent-recall--simple--v1-skill.json",
      "sha256": "1c21618df20a30a371d0842dd037ca28917471b66d0702fea6a0be85cdd649e3"
    },
    {
      "path": "results/6035e93417ab81dc81b8496360f45b140416f1398a2aaec64fe3aeaccb4d27dd/agent-recall--simple--cli-kernel.json",
      "sha256": "e6bccdd7d317c023c645b531e0216ebc16e8590a54e570bfec1eec7f53ea54cd"
    },
    {
      "path": "results/6035e93417ab81dc81b8496360f45b140416f1398a2aaec64fe3aeaccb4d27dd/agent-recall--simple--plugin-kernel.json",
      "sha256": "f92aa09943a056a289abffc78beb9d74e8d01e84878ccda4e901569f106f94a5"
    },
    {
      "path": "results/6035e93417ab81dc81b8496360f45b140416f1398a2aaec64fe3aeaccb4d27dd/agent-recall--multi-step--v1-skill.json",
      "sha256": "3e001367704d2ea9fc8d466ecf74733bc2b914f9e6cab52f0bcf95d95d4779cf"
    },
    {
      "path": "results/6035e93417ab81dc81b8496360f45b140416f1398a2aaec64fe3aeaccb4d27dd/agent-recall--multi-step--cli-kernel.json",
      "sha256": "72777d8dccf75e95919f9b102bc64360019acae780ba48ed57c5bc1a5b6442fd"
    },
    {
      "path": "results/6035e93417ab81dc81b8496360f45b140416f1398a2aaec64fe3aeaccb4d27dd/agent-recall--multi-step--plugin-kernel.json",
      "sha256": "24a8e4b3273a0eb3544916bd4db85901455d25af6bbf92cbcd5365773537734e"
    },
    {
      "path": "results/6035e93417ab81dc81b8496360f45b140416f1398a2aaec64fe3aeaccb4d27dd/agent-recall--bug-fix--v1-skill.json",